,Title,Date,Category,Content
22,Studia w Chinach,27/04/2020,"Studia, Życie w Chinach","
Czy warto studiować w Chinach? Odpowiedź jest krótka – warto! Studia w Chinach to niesamowite doświadczenie, które może przynieść nam korzyści na wielu płaszczyznach. Jak wyglądają studia w Chinach? Co warto wiedzieć, jak się przygotować i jak aplikować na studia w Chinach? Zapraszam do lektury.
Dlaczego warto wyjechać na studia do Chin
Studia w Chinach oferuję wiele korzyści z perspektywy studenta zagranicznego. Chińskie uniwersytety posiadają bardzo bogate zaplecze naukowo-badawcze, którego może pozazdrościć nie jeden uniwersytet w Polsce.
Większość uniwersytetów udostępnia darmowe kursy języka chińskiego dla swoich zagranicznych studentów. O tym dlaczego warto uczyć się chińskiego znajdziesz tutaj.
Dyplom ukończenia studiów w Chinach to niewątpliwie atrakcyjny punkt w CV dla pracodawców. Pokazuje on nie tylko Twoją ambicję, ale także odwagę i doświadczenia międzykulturowe,  dzięki któremu Twój profil będzie się wyróżniał, a co za tym idzie łatwiej będzie Ci znaleźć dobrą pracę.
Studia, to nie tylko nauka, ale także życie studenckie. Życie studenckie w Chinach opisałem szerzej tutaj.
Mieszkając w Chinach możesz podróżować za grosze po całej Azji. Będąc w Chinach otwierasz sobie drzwi na całą Azję, po której przemieszczanie się jest bardzo proste i tanie.
System edukacyjny w Chinach
Podobnie jak w Polsce, w Chinach również istnieje podział na studia licencjackie, inżynierskie, magisterskie i doktoranckie. W zależności od uczelni studia licencjackie mogą trwać 3-4 lata, magisterskie 2-3 lat, a doktoranckie nawet do 5 lat. 
W przypadku studiów licencjackich mogą się składać z 3 lat nauki oraz 1 roku praktyk. Studia magisterskie zazwyczaj składają się z 3 semestrów nauki i 3 semestrów praktyk lub czasu na napisanie pracy magisterskiej.
Rekrutacja
Proces rekrutacyjny zazwyczaj wygląda podobnie do naszych uniwersytetów. Należy dostarczyć formularz aplikacyjny najwyższy uzyskany dyplom, skan paszportu, listy polecające od pracownika naukowego (doktor habilitowany lub profesor), certyfikat językowy potwierdzający znajomość języka angielskiego lub chińskiego. 
Certyfikat językowy to zazwyczaj minimum HSK4 dla języka chińskiego, a dla angielskiego TOEFL  lub IELTS.
Aby zwiększyć szansę dostania się na chiński Uniwersytet, warto pochwalić się osiągnięciami naukowymi, udziałem w konferencjach, publikacjami, czy też innymi związanymi z kierunkiem studiów projektami.
Uniwersytety
Listę uniwersytetów w Chinach można znaleźć tutaj. Im wyższy poziom uniwersytetu, tym większe jego zainteresowanie studentów, a co za tym idzie tym trudniej się dostać. 
Kampus uniwersytecki w Chinach – Chengdu
Uniwersytety podobnie jak w Polsce podzielone są na te specjalizujące się w danej dziedzinie nauki. 
Rok akademicki
Studia w Chinach podzielone są na dwa semestry. Rok akademicki zaczyna się we wrześniu, a przerwa zimowa trwa zazwyczaj od stycznia do marca (w zależności od tego jak przypada Chiński Nowy Rok). Semestr letni kończy się w lipcu.
Zaliczenia egzaminów
Podobnie jak w Polsce zaliczenia egzaminów odbywają się w formie egzaminu pisemnego na koniec semestru. Jednakże wiele uczelni preferuję zaliczenia w formie prac pisemnych. 
Często zdarza się, że obcokrajowcy mogą sami wybrać formę zaliczenia. Wszystko zależy od uniwersytetu.
Życie studenckie
Chińscy studenci spędzają nieco inaczej czas niż ich Polscy rówieśnicy, jednakże studiowanie w Chinach może być tak samo zabawne. Istnieje wiele klubów studenckich, a także barów, pubów, które oferuję specjalne zniżki dla obcokrajowców, aby przyciągnąć klientów. Więcej o życiu chińskich studentów tutaj.
Ile kosztują studia w Chinach?
W zależności od kierunku i uniwersytetu czesne może wahać się między 10,000 a 30,000+ RMB za rok akademicki. Kurs języka chińskiego w Chinach może kosztować od 3,000 RMB za semestr. 
Jak dostać się na stypendium do Chin
Chiny oferuję liczne stypendia dla obcokrajowców. Stypendia bardzo często pokrywają koszta nauki oraz dodatkowo oferuję pieniądze na życie, które w zupełności wystarczają na komfortowe życie w Chinach. 
O tym, które stypendium wybrać i jak aplikować na stypendium do Chin pisałem tutaj.
Wiza do Chin
Wiza to najmniejszy problem planując studia w Chinach. Po tym jak uniwersytet nas zaakceptuje i/lub otrzymamy stypendium, to dostaniemy dokładne wytyczne od uniwersytetu. 
Warto przygotować tłumaczenie niezbędnych dokumentów takich jak dyplom, oceny, i inne wymagane przez uniwersytet papiery. Co do szczegółów najlepiej kontaktować się z ambasadą oraz uniwersytetem, ponieważ wymagania mogą być różne. 
Trzeba się przygotować na to, że przed wyjazdem trzeba będzie dostarczyć certyfikat zdrowia, który składa się podstawowego badania, testów krwi m.in. na HIV. 
Niemniej jednak, nie ma co się przejmować, o ile nie byliśmy karani, wiza to nie problem!
Ubezpieczenie 
Studiując w Chinach jesteśmy zobowiązani do ubezpieczenia się za pośrednictwem uniwersytetu. Jednakże warto wykupić dodatkowe ubezpieczenie, które pokryje nam koszty leczenia w razie potrzeby.
Jak znaleźć mieszkanie w Chinach
Studiując w Chinach możesz mieszkać w akademiku lub zdecydować się na wynajem mieszkania. W zależności od miasta ceny wynajmu różnią się. Jednakże jeśli wybierzemy miasto “drugiego sortu”, jak np. Chengdu, Xian, Hangzhou itp., to ceny wynajmu za dobrej jakości studio mogą zaczynać się już od 600 zł za miesiąc. 
Jeśli chcesz szukać mieszkania w Chinach, to polecam zrobić to na miejscu. Po określeniu, w której okolicy chcesz zamieszkać najlepiej przejść się dookoła i zapukać do drzwi pośrednika, które znajdują się niemalże na każdym rogu.
Osiedle mieszkaniowe w Chinach
Przykładowi pośrednicy to Lianjia lub Anjuke. Jeśli potrzebujesz pomocy, to chętnie udzielę Ci darmowej porady jak znaleźć mieszkanie w Chinach.
Studia w Chinach a praca
Studiując w Chinach obcokrajowcy nie mogę legalnie pracować. Jednakże jest możliwość otrzymania zgody na praktyki studenckie. 
Praktyki nie powinny przekraczać więcej niż 20 godzin tygodniowo (czasem zależy to od uniwersytetu lub miasta), a także powinny być nieodpłatne. Jednakże często da się dogadać z pracodawcą i dostać wypłatę mimo to. 
Studia a język chiński
Aby studiować w Chinach nie musimy znać języka chińskiego. Warto jednak znać podstawy lub nawet posiadać certyfikat znajomości języka chińskiego HSK, który niewątpliwie pomaga w procesie rekrutacyjnym. 
Będąc studentem chińskiego uniwersytetu zazwyczaj możemy uczęszczać na darmowe zajęcia z języka chińskiego. 
"
23,Jak wyjechać na studia do Chin? Rodzaje stypendiów do Chin.,25/04/2020,"Studia, Życie w Chinach","
Studia w Chinach to niewątpliwie egzotyczny, aczkolwiek atrakcyjny kierunek. Stosunkowo niewielu studentów decyduje się na studia w Państwie Środka, jednakże w ostatnich latach zainteresowanie wschodnim kierunkiem stopniowo wzrasta. 
Chiny oferując szeroki wachlarz ofert stypendialnych zachęcają rzesze obcokrajowców do przyjazdu nie tylko na studia, ale także kursy językowe. Nie ma co się temu dziwić, ponieważ stypendia do Chin są bardzo atrakcyjne nie tylko pod względem edukacyjnym, ale także finansowym. A co więcej, stosunkowo łatwo dostać się na stypendium do Chin.
Studia w Chinach
Życie w Chinach to niesamowite doświadczenie, które nie tylko budzi ciekawość rekruterów w CV, ale także pozwala lepiej poznać świat. Decydując się na wyjazd do Chin musimy być gotowi na zderzenie z kompletnie obcym światem, który dzięki swojej odmienność jest tak bardzo fascynujący.
Studia w Chinach pod względem samej struktury edukacyjnej wyglądają bardzo podobnie do studiów w Polsce i innych miejscach na świecie. Różnią się natomiast długością trwania studiów. Licencja może trwać nawet 4 lata, a studia magisterskie 3 lata. 
W przypadku studiów licencjackich w większości przypadków składają się na 3 lata nauki oraz jednego roku praktyk, w którym wchodzi czas na napisanie pracy zaliczeniowej.

Studia magisterskie w zależności od kierunku mogą trwać nawet 3 lata, na które składają się trzy semestry nauki, oraz trzy semestry na napisanie pracy magisterskiej.
Studiowanie w Chinach jest niesamowitym doświadczeniem, o którym więcej pisałem tutaj.
Kurs języka chińskiego w Chinach
Wielu studentów decyduje się na wyjazd do Chin w celu nauki języka chińskiego. Niemalże każdy uniwersytet oferuje kursy języka chińskiego dla obcokrajowców. Jak wygląda taki kurs?
Zazwyczaj zajęcia z praktycznej nauki języka chińskiego odbywa się od poniedziałku do piątku od godzin porannych do około 12. W zależności do uniwersytetu po południu mogą odbywać się dodatkowe zajęcia kulturowe, jednakże nie jest to żadnym standardem.
Kursy chińskiego w Chinach są przystosowane dla osób z każdym poziomem języka chińskiego. Liczba osób w grupie i konkretny plan zajęć zależy od placówki, jednakże zazwyczaj rozróżniamy cztery rodzaje zajęć: pisanie, czytanie, mówienie i zajęcia ogólne z języka chińskiego.
Stypendium na studia do Chin
Chiny, a także inne państwa, czy też instytucję oferują wiele rodzajów stypendiów na studia do Chin. Spośród szerokie wachlarza ofert wybrałem dwa najbardziej powszechne rodzaje stypendiów na studia do Chin.
Stypendium Rządu Chińskiego (CSC)
Chinese Scholarship Council znany również jako Stypendium Rządu Chińskiego (Chinese Government Scholarship), to jeden z najatrakcyjniejszych wyborów jeśli chodzi o oferty stypendialne. 
CSC oferuje programy stypendialne na studia licencjackie, magisterskie, doktoranckie, a także kursy językowe roczne lub semestralne.
Pełne stypendium CSC oferuje:
3500 RMB + 700 RMB (lub miejsce w akademiku) + czesne dla studentów studiów doktoranckich3000 RMB + 700 RMB (lub miejsce w akademiku) + czesne dla studentów studiów magisterskich2500 RMB + 700 RMB (lub miejsce w akademiku) + czesne dla studentów studiów licencjackich2000-2500 RMB + 700 RMB (lub miejsce w akademiku) + czesne dla studentów kursu językowego
Warto zaznaczyć, że pieniądze oferowane przez CSC w zupełności wystarczają na życie w Chinach. Wybierając nieco mniejsze miasto np. Chengdu, Changsha, Kunming, czy też Hangzhou, pieniądze wystarczą nam nawet na wynajem mieszkania i życie. 
Nie ma co się rozpisywać, student może wybrać uniwersytet, na który chciałby aplikować, a także kierunek, który go interesuje. W zależności do uniwersytetu, a także kierunku, wymagania do otrzymania stypendium mogą być inne. Niemniej jednak, warto pamiętać, że im lepsze nasze oceny i portfolio, tym większe mamy szanse. 
Co istotne, nie każdy kierunek wymaga znajomości języka chińskiego. Możliwe jest studiowanie w języku angielskim, jednakże musimy w jakiś sposób udowodnić naszą znajomość angielskiego.
Jeśli chodzi o kursy językowe, to wymagania są dużo mniejsze niż w przypadku studiów wyższych, jednakże warto zaznaczyć, że posiadanie udokumentowanej znajomości języka chińskiego w postaci certyfikatu HSK może zwiększyć nasze szanse.
Jak aplikować na stypendium rządu chińskiego?
Dwa najpopularniejsze kanały, przez które możemy złożyć aplikację, to Ambasada Rządu Chińskiego w Polsce, a także chiński uniwersytet.
W pierwszym przypadku sprawa jest o tyle prostsza, że nie musimy się nawet kontaktować z uniwersytetem w Chinach. Jednakże, w ostatnich latach aplikowanie przez ambasadę stało się nieco bardziej skomplikowane. 
Studenci muszą odbyć coś na wzór rozmów kwalifikacyjnych, które będę kolejnym czynnikiem decydującym o otrzymaniu stypendium.
Kolejnym minusem ubiegania się o stypendium poprzez ambasadę jest dokładanie kolejnej instytucji, która musi zatwierdzić naszą aplikację. Mówiąc dość skrótowo, jeśli złożymy aplikację na stypendium w ambasadzie, to najpierw będzie musiała zostać zatwierdzona przez ambasadę w Polsce, następnie przez instytucję w Pekinie, potem przekazana do uniwersytetu, który również musi ją zatwierdzić, a potem znowu wraca ona do Pekinu, który podejmuje ostateczną decyzję.

Nie mówi się o tym głośno, ale biorąc pod uwagę statystyki, ambasada co roku ogłasza krótką listę około 50 osób, którym zostanie przyznane stypendium. Warto również dodać, że ambasada preferuje kierunki ekonomiczne lub technologiczne, a inaczej to ujmując, takie których absolwenci mogą wnieść coś do relacji pomiędzy Polską a Chinami.
Więcej na temat procesu aplikacyjnego można znaleźć tutaj i tutaj.
Składanie aplikacji bezpośrednio przez uniwersytet
Minusem tej opcji jest to, że wymaga ona od nas bezpośredniego kontaktu z uniwersytetem. Co w tym trudnego? Co mojego doświadczenia na około 50 wysłanych maili do różnych placówek, jedynie 2-3 z nich odpowiedziały na moją wiadomość.
Jednakże, jeśli uda nam się skontaktować z uniwersytetem, to już połowa sukcesu za nami. Warto zaznaczyć, że im gorszy uniwersytet, tym większe szanse na jego odpowiedź. Uniwersytety, szczególnie te mniejsze lub mniej znane walczą o zagranicznych studentów. Dlatego warto rozważyć aplikację również na uniwersytety znajdujące się niżej w rankingu, aby zwiększyć nasze szanse. Często mniejsze uniwersytety oferuję lepsze kursy języka chińskiego, a ich poziom nauczania nie różni się znacząco od tych z topu.
Niewątpliwym plusem bezpośredniego kontaktu z uniwersytetem, jest fakt, że zawężamy listę instytucji, które muszą przepchnąć naszą aplikację. W tym przypadku, gdy uniwersytet zgodzi się na naszą aplikację, to wysyła ona papiery do Pekinu, który podejmuje ostateczną decyzję.
Kolejnym plusem jest to, że uniwersytety często mogą pomóc nam w dodatkowej aplikacji na inne stypendia, np. stypendia prowincjonalne. Im więcej aplikacji złożymy, tym większe nasze szanse.
Lista chińskich uniwersytetów dostępna jest tutaj. 
Więcej wskazówek dotyczących aplikacji można dowiedzieć się bezpośrednio od uniwersytetu, ponieważ każdy z nich może mieć różne procesy. 
Stypendium Instytutu Konfucjusza
Kolejnym i ostatnim opisanym przeze mnie rodzajem stypendium jest stypendium Instytutu Konfucjusza.
Instytut Konfucjusza oferuje również stypendia na kursy językowe oraz studia do Chin. Jednakże, w przypadku Instytutu Konfucjusza, oferowane kierunki studiów ograniczają się do języka chińskiego, a konkretnie jego nauczania.
Instytut Konfucjusza oferuje:
3500 RMB + 700 RMB (lub miejsce w akademiku) + czesne dla studentów studiów doktoranckich3000 RMB + 700 RMB (lub miejsce w akademiku) + czesne dla studentów studiów magisterskich2500 RMB + 700 RMB (lub miejsce w akademiku) + czesne dla studentów studiów licencjackich2000-2500 RMB + 700 RMB (lub miejsce w akademiku) + czesne dla studentów kursu językowego
Aby aplikować o stypendium Instytutu Konfucjusza należy bezpośrednio skontaktować się z Instytutem Konfucjusza np. w Polsce. Warto zaznaczyć, że aby aplikować o stypendium Konfucjusza należy posiadać certyfikat językowe HSK na różnym poziomie w zależności od kierunku, na które aplikujemy.
Z mojego doświadczenia powiem, że o ile nie interesuję Cię zostaniem nauczyciela języka chińskiego, to raczej skup się na stypendium rządu chińskiego, ponieważ jest ono bezpieczniejszą opcją pod wieloma względami.
Instytut Konfucjusza stawia zazwyczaj większe wymagania co do swoich studentów, często stawiając przed uczniem celów, których jeśli nie spełnią, to będę mieć obcinane stypendium. Stypendium Rządu Chińskiego oferuje również dodatkowe bonusu, które są oferowane przez niektóre uniwersytety. Są tam często bezpłatne weekendowe wycieczki, czy też zorganizowany udział w konferencjach lub targach.
Jeśli interesuję Cię wyjazd na studia do Chin i potrzebujesz pomocy, to zachęcam do kontaktu. Chętnie podzielę się swoim doświadczeniem. Pomogę Ci również przygotować się do certyfikatu językowego HSK, który niewątpliwie pomoże Ci w aplikacji. Jest to kolejny powód, dla którego warto uczyć się języka chińskiego.
"
24,Jak wygląda życie studenta w Chinach?,23/04/2020,"Studia, Życie w Chinach","
Życie studenta a koronawirus
W dobie koronawirusa życie studenta w Chinach zmieniło się diametralnie. Co tu dużo mówić, studenci w większości siedzą w domach, a zajęcia i zaliczenia odbywają się online. Wykłady są zazwyczaj prowadzone na platformach ZOOM lub QQ. Nic nowego, nic ciekawego.
Obecnie duże utrudnienie w życiu chińskich studentów stanowią pozamykane kampusy, ponieważ wielu z nich zostawiło tam rzeczy, po które nie mogą wrócić. Co prawda, chińskie uczelnie wyższe powoli przygotowują się do otwarcia bram kampusów, jednakże mówi się o tym głośno, że uczniowie wrócą do sal lekcyjnych dopiero w przyszłym roku akademickim. 
Życie studenta przed koronawirusem
Życie studenckie w Chinach różni się diametralnie od życia studenckiego w Polsce. Myślę, że wiele osób zgodzi się ze mną, że studia w Chinach pod względem życia społecznego i kontaktów międzyludzkich jest bliższe naszemu liceum niż uniwersytetowi. 
Wielu moich kolegów i koleżanek ze studiów miało duże problemy z komunikacją interpersonalną. Być może wynikało to z braku pewności siebie lub po prostu brakiem doświadczenia w prostych sytuacjach społecznych, jednakże dotyczyło to bardzo licznej grupy osób. Brak umiejętności miękkich to nie tylko zmora chińskiego społeczeństwa, aczkolwiek to nie temat na ten artykuł.

Rozrywka
W związku z powyższym, moja integracja z chińskimi studentami ograniczała się do okazjonalnych wyjść do restauracji, czy też przypadkowo napotkanych studentów w chińskich klubach i barach.
Chińczycy raczej rzadko wychodzą do klubów, pubów i barów, aby po prostu napić się piwa lub potańczyć. Studenci ograniczają raczej swoje rozrywki do jedzenia plus innych towarzyszących temu aktywności. Jedzenie to religia w Chinach, a słynny hot pot (gorący garnek), to must have wyjścia ze znajomymi.
Poza jedzeniem ulubioną rozrywką chińskich studentów jest KTV, czyli karaoke. KTV jest niesamowicie rozwinięte w Chinach. Lokale oferujące karaoke przypominają raczej 5 gwiazdkowe hotele, w których wynajmuje się prywatne pokoje. 
Chińczycy uwielbiają śpiewać, dlatego KTV to nie tylko rozrywka, ale swojego rodzaju pokaz umiejętności wokalnych, które są bardzo wysoko cenione w kulturze Chin. Poza śpiewaniem w KTV pije się alkohol. Dużo alkoholu. Chińczycy zazwyczaj wybierają piwo lub okazjonalnie baijiu (chińska wódka, która pachnie jak rozpałka do grilla). 
Pomimo swojej drobnej postury, Chińczycy potrafią pić, a w szczególności Ci z Mongolii Wewnętrznej, o czym opowiem w innym poście.
Życie codzienne
Zaczęliśmy od rozrywki, ale jak wygląda życie codzienne studentów? To zależy od tego na jakim uniwersytecie i co studiują. Studenci najlepszych uniwersytetów mają zazwyczaj trochę więcej pracy, aczkolwiek jest to w dużym stopniu uwarunkowane kierunkiem studiów.
Mocno generalizując studenci kierunków ekonomicznych mają sielankę, a filolodzy muszą się nieźle napocić. Nie ma co ukrywać, że zagraniczni studenci mają łatwiej, aczkolwiek chińscy studenci trudno nie mają.
Większość chińskich studentów żyje w położonych na kampusie akademikach. W zależności od kampusu i stopnia studiów mogą mieszkać pojedynczo, a czasem nawet po kilka osób w jednym pokoju.  
Często zdarza się, że prysznice znajdują się w innym budynku, a ciepła woda dostępna jest jedynie do godziny 22. Podobnie ma się z prądem, który czasem jest ograniczany w późnych godzinach, jednakże słyszałem tylko kilka takich przypadków.
Poza nauką, studenci uwielbiają oglądać seriale i filmy, a także grać w gry. Niewielka część z nich regularnie uprawia sport. Natomiast bardzo duży odsetek studentów jest zaangażowany w różne kółka zainteresowań oraz wolontariaty.
Wynika to głównie z tego, że aktywność w życiu studenckim jest bardzo istotnym elementem CV. Dlatego też tak wielu z nich pomaga wykładowcom i angażuje się we wszystko, co tylko możliwe.

Gdzie stołują się studenci
Skoro Chińczycy mieszkają w akademikach położonych na terenie kampusu, to co jeszcze ukrywa się na terenie kampusu? Czasem nawet dziesiątki stołówek. Stołówki to nieodłączna część chińskiego studenckiego życia. 
Zacznijmy od tego, że jest wiele rodzajów stołówek, które oferują różnego rodzaju kuchnie. Niemalże każdy kampus uzbrojony jest w stołówkę halal z niesamowitą kuchnią. Poza tym można znaleźć stołówki śniadaniowe lub takie, w które otwierają się tylko w nocy i serwują street food. 
Stołówki są zazwyczaj bardzo tanie. Danie składające się z ryżu, warzyw i mięsa można już dostać za niecałe 4zł. 
Zakupy
Ostatnie, jednakże jak bardzo ważne, to zakupy. Dlaczego właśnie zakupy? Ponieważ są one bardzo dużą częścią życia chińskich studentów. 
Jednakże w olbrzymiej większości ograniczają się do zakupów internetowych. Chińczycy przeglądają TaoBao (chińskie allegro), tak jak my przeglądamy Facebooka. Cykliczne promocje przyciągają miliony studentów, którzy często wydają większość oszczędności, po to aby kupić wymarzoną rzecz.
Trzeba oddać, że TaoBao jest niesamowite. Interfejs jest tak czytelny i prosty, że zakupu przedmiotu można dokonać w niecałe 3 sekundy. Co więcej, do większości przedmiotów oferowana jest darmowa wysyłka, dzięki czemu możemy kupić ołówek za 10 groszy, który przyleci do nas z oddalonego o 2,000 km zakątka Chin.
Podsumowując, w powyższym artykule krótko przedstawiłem podstawowe elementy życia studenckiego w Chinach. Różnice kulturowe są na tyle duże, że o każdym z tych elementów można by napisać obszerną książkę, jednakże takiej analizy podejmę się innym razem.
"
25,"Kuchnia chińska, przepis na kurczaka kung pao",22/04/2020,Kuchnia,"
宫保鸡丁, jak kto woli kurczak kung pao lub gong bao, to tradycyjna potrawa kuchni chińskiej, a dokładniej syczuańskiej.
Kuchnia syczuańska jest uważana przez wielu chińczyków za kwintesencję kuchni chińskiej. Spowodowane jest to nie tylko ostrym aromatem, ale również niepowtarzalnym smakiem, który często podkreśla syczuański pieprz. Kuchnia syczuańska może przede wszystkim kojarzyć się ze słynnym hot potem (gorącym garnkiem), ale składa się na nią wiele innych cudownych dań.
Kurczak kung pao
Kurczak kung pao jest jedną z najbardziej charakterystycznych potraw kuchni chińskiej. Potrawa uwielbiana w szczególności przez obcokrajowców. Połączenie orzeszków, kurczaka i warzyw, a wszystko doprawione klasycznym chińskim zestawem przypraw sprawia, że ciężko nie polubić tego dania.
Zwiedzając wiele zakątków Chin próbowałem kurczaka kung pao w wielu restauracjach. Smak kurczaka kung pao różnił się w zależności od regionu i lokalnego smaku. Jednakże z duża dawką pewności stwierdzam, że syczuański kurczak kung pao wygrywa wszystko. 
Przepis na kurczaka kung pao
W niemalże każdej prowincji, każdym mieście, każdej restauracji kurczak kung pao przyrządzany jest w inny sposób. Podany przeze mnie przepis jest najbardziej zbliżony do tradycyjnego przepisu używanego w syczuanie. 
To właśnie w Chengdu zakochałem się w kurczaku kung pao na nowo, dlatego subiektywnie wybrałam przepis pochodzący z miasta pand.
Kurczak kung pao – składniki
Do przygotowania kurczaka kung pao dla dwóch osób należy przygotować:
Główne składniki:
5g świeżego czosnku 
300g piersi z kurczaka
50g orzeszków ziemnych
Składniki do dressingu i przyprawy:
5g sosu sojowego
10g wina do gotowania
szczypta soli
Łyżeczka cukru (w zależności jak słodkie lubimy potrawy)
15g mąki kukurydzianej
25g suszonych papryczek chili (w zależności jaką ostrość chcemy uzyskać)
5g świeżego imbiru
15g octu
15g pora (lub cebula dymka)

Sposób przygotowania kurczaka kung pao.
Należy drobno pokroić pora w około 1cm kawałki. Następnie drobno posiekaj ząbki czosnku, a imbir pokrój w cieniutkie plasterki. Następnie pokrój kurczaka w drobne kostki.
Przyprawa kurczaka odrobiną soli.
W osobnej miseczce przygotuj dressing. Wymieszaj sos sojowy, ocet, cukier, mąkę ziemniaczaną, a następnie wszystko zamieszaj.
Rozgrzej na patelni olej, a następnie dodaj kurczaka, imbir i czosnek. 
Smaż kilka minut, a następnie dodaj por, przygotowany dressing oraz suszone papryczki chili.
Pod koniec smażenia dodaj orzeszki i smaż przez około minutę. 
Jak to w chińskiej kuchni bywa, danie najlepiej smakuje z ryżem i gorącą wodą!
"
