,Title,Date,Category,Content
15,Nowy format HSK!,20/05/2020,Język chiński,"
Jak podaje 元任对外汉语  nowy format egzaminu HSK został już zaakceptowany. Jedną z głównych zmian jest podzielenie egzaminu na 9 poziomów, a także wprowadzenie zadania tłumaczeniowego.
Już w 2015 r. w siedzibie Instytutu Konfucjusza rozpoczęto opracowywanie nowych standardów HSK przy wsparciu kilkudziesięciu chińskich i zagranicznych ekspertów i naukowców oraz Chińskiej Komisji Języka Narodowego. Po pięciu latach ciężkiej pracy narodził się nowy format egzaminu HSK, który powinniśmy ujrzeć już wkrótce.
Co znajdziemy w nowym formacie HSK?
W porównaniu z poprzednim formatem nastąpiły trzy główne zmiany: 
Nowy format ma na celu określenie czterowymiarowego systemu indeksu kwantyfikacji języka: sylab, chińskich znaków, słownictwa i gramatyki, w celu dokładnego zweryfikowania poziomu języka chińskiego ucznia.Podzielenie egzaminu na trzy kategorie: początkujący, średnio zaawansowany i zaawansowany. Dodatkowo, kategorie podzielono na 9 poziomów (po 3 na każdą kategorie), czyli o 3 więcej w porównaniu do poprzedniego formatu.Trzecia zmiana polega na wykorzystaniu powszechnie akceptowanych teorii uczenia się języków, w szczególności komunikatywnych modeli umiejętności językowych Bachmana. Dla każdego poziomu, użyty zostanie wskaźnik kwantyfikacji języka, umiejętności komunikacji werbalnej i rozumienia treści zadania tematycznego. Dodatkowo, egzamin będzie miał na celu zweryfikować pięć wymiarów umiejętności językowych, na które składają się słuchanie, mówienie, czytanie, pisanie i tłumaczenie. Nowa ścieżka „3 + 5”, ma odzwierciedlać biegłą znajomość języka chińskiego w sposób kompleksowy i trójwymiarowy.
Niewątpliwie jest to ciekawy pomysł. Dotychczas co do formatu HSK można było mieć sporo zastrzeżeń. Jego obecna forma, szczególnie w przypadku wyższych poziomów, jest słabym odzwierciedleniem wiedzy językowej. Być może podzielenie go na 9 poziomów pozwoli w lepszy sposób zweryfikować poziom językowy ucznia. 
Jeśli informacje się potwierdzą, to czeka nas nowa część tłumaczeniowa. Tutaj pojawia się pytanie, czy twórcy przewidzieli lokalizację tej części, a jeśli tak, to jak będzie przebiegał proces sprawdzania.
Póki co nie jest to oficjalna informacja, a więc przyjdzie nam poczekać jeszcze kilka tygodni na potwierdzenie tych doniesień. Niemniej jednak, nowy format zapowiada się ciekawie.
"
16,Wtyczki do nauki chińskiego,18/05/2020,Język chiński,"
Zhongwen – wtyczka do nauki chińskiego
Jedna z najpopularniejszych wtyczek do nauki języka chińskiego, która zebrała ponad 70,000 użytkowników. Bardzo prosta i szybka w użyciu, a co więcej bez żadnych reklam. 
Zhongwen jest narzędziem, dzięki któremu możemy tłumaczyć chińskie znaki. Wystarczy najechać na znak myszką, a tłumaczenie wyświetli się samo. 

Dodatkowo, w przypadku niektórych słów po naciśnięciu “g” na klawiaturze zostaniemy przeniesieni do strony wyjaśniającej gramatykę danego znaku.

Poza gramatyką i tłumaczeniem, możemy również sprawdzić tony, które oznaczone są różnymi kolorami, a także klasyfikatory w przypadku rzeczowników.
Wtyczkę do Chrome można pobrać tutaj. 
New Tong Wen Tang – konwerter znaków
Bardzo przydatna wtyczka, która umożliwia nam konwertowanie znaków z uproszczonych do tradycyjnych i na odwrót. 

Po otwarciu opcji wtyczki możemy spersonalizować ustawienia pod nasze potrzeby.
Dodatkowo, wtyczka umożliwia nam manipulowanie ustawieniami w kontekstowym menu. Możemy konwertować znaki z tradycyjnych na uproszczone i na odwrót, a także konwertować znaki zapisane w schowku.

Wtyczka w wersji dla Chrome dostępna jest tutaj.
"
17,Chiński YouTube – przegląd aplikacji,12/05/2020,"Kultura, Technologia","
Ciężko w Chinach znaleźć aplikację, którą można by nazwać chińskim YouTubem. Chiński YouTube niestety jeszcze nie powstał, jednakże, istnieje kilka aplikacji, które można do niego porównać.
Chińskie aplikację można porównać do YouTube na wielu płaszczyznach. Zaczynając od ich charakteru, odbiorców, twórców, a kończąc na aspektach finansowych. Poniżej zamieszczam listę aplikacji, które moim zdaniem najbardziej wypełniają rolę chińskiego odpowiednika YouTube w Chinach.
Chiński YouTube
Youku
Youku to usługa hostingu wideo z siedzibą w Pekinie w Chinach, która działa w ramach grupy Alibaba. Platforma Youku od wielu lat istnieje na rynku i wyznacza trendy w chińskiej popkulturze. 
Na Youku dawniej można było znaleźć amatorskie filmy tworzone na wzór treści umieszczanych na YouTube, które często były również z niego kopiowane. W tamtym czasie Youku funkcjonowało na wzór chińskiego YouTube’a, jednakże od paru lat Youku zmieniło swój profil. 

Obecnie Youku można bardziej porównać do Netflixa, czy też polskiego Playera. Youku wypełnione jest serialami, filmami, dokumentami, bajkami, a także programami rozrywkowymi. Dostęp do większości treści jest możliwy jedynie po zakupie konta VIP, które działa podobnie do subskrypcji na Netflixie. 
Istnieje jeszcze kilka innych podobnych do Youku platform, jak np. iQIYI, które wydaje się być największym rywalem Youku. Struktury obu platform są bardzo podobne, a ich rywalizację można by porównać do starcia pomiędzy Netflix i HBO.
Douyin – TikTok

Mówiąc o chińskim YouTube ciężko nie wspomnieć o Douyin, znanym poza Chinami jako TikTok.
Douyin, to aplikacja mobilna, która służy do tworzenia i udostępniania krótkich treści video, które zazwyczaj nie przekraczają 15 sekund.
W zeszłym roku Douyin w Chinach chwalił się ponad 250 milionami aktywnych użytkowników dziennie, obecnie liczba ta wzrosła do 400 milionów. Ogromna popularność Douyina dotarła poza granice Chin, gdzie pod nazwą TikTok buduje coraz silniejszą markę przyciągając takie gwiazdy jak np. Robert Lewandowski.
Biorąc pod uwagę popularność oraz aspekty finansowe, gwiazdy Douyina można nazwać chińskimi youtuberami. Podobnie do youtuberów, ich główny przychód oparty jest na reklamach i sponsorach. 
Gwiazdy Douyina mogą liczyć na sponsorów jeśli ich oglądalność utrzyma się na liczbie co najmniej 10 milionów odsłon, co można porównać do polskiego odpowiednika 10,000 wyświetleń na YouTube.
Live Streaming – aplikacje
Na koniec warto umieścić na liście aplikację służące do tworzenia relacji na żywo. Pomimo, że tylko częściowo można by je sklasyfikować pod etykietą “chiński YouTube”, to ciężko przejść obojętnie obok ich popularności.
Najbardziej znane aplikacje do tworzenia relacji na żywo, to m.in. YY, Momo, Huajiao i Inke. To właśnie o YY powstał bardzo ciekawy film dokumentalny – Ludowa Republika Pożądania.

Live Streaming w Chinach wszedł na poziom, którego YouTube może póki co jedynie pozazdrościć. Tego typu aplikacji zyskały popularność i uznanie w Chinach już wiele lat temu.
Ich struktura jest bardzo prosta i działa podobnie do obecnego YouTube’a. Streamerzy przyciągają fanów, którzy chcąc zwrócić uwagę swojego idola, wysyłają mu prezenty, którymi są pieniądze. 
Za streamerami stoją potężne agencję, które wyłapują talenty i w zamian za prowizję, szkolą swoich podopiecznych i wskazują im drogę. 
Co roku odbywa się wielki pojedynek streamerów, który podzielony jest na kategorie, a wygrywa ten, kto zdobędzie najwięcej głosów – pieniędzy. Fani identyfikują się z idolami do tego stopnia, że często wydają całe swoje oszczędności, aby tylko zobaczyć swoje gwiazdy na pierwszym stopniu podium.
Dlaczego nie istnieje Chiński YouTube?
To pytanie, na które nie ma jednoznacznej odpowiedzi. Jedni doszukują się problemów ze skupieniem uwagi Chińczyków na dłuższych treściach, a inni szukają winy wśród wielkich wytwórni, które szybko przechwytują talenty i tworzą swoje autorskie programy.
Jednakże, popularność Douyina i aplikacji live streamingowych niejako odpowiada na to pytanie. Douyin zapewnia krótką, szybką, zmienną, dynamiczną i niekończąca się rozrywkę, która nie wymaga wysiłku intelektualnego, czy też wielkiej uwagi. 
Natomiast aplikacje live streamingowe pozwalają użytkownikom w łatwy sposób nawiązać uczuciową relację z ich idolem, która ze względu na ich problemy społeczne, często wypełnia zakładkę relacji w ich życiu, co doskonale zilustrował wyżej wymieniony dokument.
"
18,Święto pracy w Chinach,04/05/2020,"Wiadomości, Życie w Chinach","
Długi weekend majowy, to pierwsze duże święto w Chinach od momentu poluzowania restrykcji wywołanych przez wybuch koronawirusa. Święto pracy w Chinach wiążę się co roku z 5 dniową przerwą i stanowi jedną z najważniejszych pozycji w kalendarzu.
W związku z wybuchem koronawirusa majówka stała pod wielkim znakiem zapytania. Święto pracy w Chinach co roku wiąże się ze wzmożonym ruchem turystycznym. W związku z tym, zarówno firmy, jak i szkoły wydawały komunikaty nawołujące do pozostania w domach i unikania tłumów. Jednakże władze poprzez swoje działania jednocześnie dawały zielone światło dla podróżujących. 
W celu ożywienia przemysłu turystycznego, władze otworzyły setki miejsc do zwiedzania, w tym Zakazane Miasto w Pekinie, które zostało otwarte po raz pierwszy od wybuchu koronawirusa.
Według danych chińskiego Ministerstwa Kultury i Turystyki, 1 maja odnotowano ponad 23 miliony turystów krajowych. 
Ministerstwo Transportu szacowało nawet 23,36 miliona podróżnych dziennie w tym okresie. Niemniej jednak, liczby te nie nawet nie równają się z zeszłorocznymi rachunkami, kiedy to liczba podróżujących dziennie przekroczyła 67 milionów.
Przemysł turystyczny ruszył również w prowincji Hubei. Departament Turystyki Hubei podał, że 22 ponownie otwarte spoty turystyczne odwiedziły 1 maja 109664 turystów, czyli o 87% mniej niż rok wcześniej. 
Źródło obrazka: echinawire
"
19,Chińskie Allegro – Taobao od środka,01/05/2020,"Technologia, Życie w Chinach","
Taobao można łatwo skojarzyć jako chińskie Allegro. Ma na to wpływ nie tylko jego podobieństwo kolorystyczne, ale przede wszystkim jego charakterystyka działania. Taobao co roku bije rekordy sprzedażowe i pomimo pojawiania się konkurencji, nadal pozostaje ulubionym wyborem chińskim internautów. Jak działa Taobao i dlaczego pokochali je Chińczycy? Zapraszam do krótkiej lektury.
E-commerce w Chinach
Chiński e-commerce rozwija się w niesamowitym tempie, co doskonale odzwierciedlają liczby. W ubiegłym roku sektor e-commerce stanowił około 35% całego rynku detalicznego. Prognozy wskazują, że chiński e-commerce może wynieść nawet połowę całego światowego rynku.
Biorąc pod uwagę, że w Chinach mamy do czynienia z ponad 800 milionami internautów, to rozwój handlu elektronicznego nie powinien nikogo dziwić.
Chińskie allegro
Na polskim rynku niezmiennie króluje Allegro, jednakże od pewnego czasu coraz częściej użytkownicy sięgają po produkty do Aliexpress. Aliexpress, pomimo że chińskie, to niewiele mówi przeciętnemu Chińczykowi.
Odpowiednikiem polskiego Allegro w Chinach jest Taobao 淘宝. Prawdą jest, że istnieje kilka innych platform konkurujących z Taobao jak np. Jingdong 京东, jednakże dzisiaj skupię się na tej pierwszej.
Taobao – strona startowa
Taobao
Chińska platforma Taobao mająca siedzibę w Hangzhou, której właścicielem jest Alibaba, to największy na świecie sklep internetowy i ósma najczęściej odwiedzana strona internetowa według Alexy.
Podobnie jak na Allegro, na Taobao zarówno sklepy, jak i osoby prywatne mogą wystawiać przedmioty. 
Warto zaznaczyć, że Taobao nie jest dostępne w wersji angielskiej, dlatego jeśli nie znamy języka chińskiego, to pozostaje użyć nam wtyczki, która przetłumaczy stronę za nas.
Jedną z moich ulubionych funkcji na Taobao jest możliwość wyszukiwania przedmiotów na podstawie jego zdjęcia. Wystarczy, że zrobimy lub wgramy zdjęcie, a Taobao znajdzie oferty na podstawie ich graficznego podobieństwa. 
Wyszukiwanie przedmiotów na podstawie zdjęcia – Taobao
Na chińskim Allegro kupimy wszystko. Oryginalny ubrania, elektronika, jedzenie, meble i wiele więcej. Ogromnym plusem Taobao jest darmowa wysyłka, która dotyczy większości przedmiotów. Możemy zamówić przedmiot o wartości 10 groszy z miasta oddalonego o 1000 km, a wysyłka nadal będzie darmowa
Prostota
To jeden kluczy do sukcesu Taobao. Taobao możemy z łatwością zintegrować z Wechat’em (chiński odpowiednik Facebooka, Instagrama, Twittera i wielu innych w jednym) lub Alipay’em (odpowiednik PayPal). 
Dzięki temu proces kupowania przedmiotu może zająć nam nie więcej niż 3 sekundy. Po naciśnięciu przycisku “Kup Teraz” wybieramy wcześniej zapisany adres, następnie potwierdzamy płatność odciskiem palca i gotowe! 
Promocje na Taobao
Co roku Taobao bije swoje zeszłoroczne rekordy sprzedażowe podczas słynnej wyprzedaży 双十一, czyli podwójna jedenastka (11.11, dzień singla).
W tym dniu sprzedawcy na Taobao oferują gigantyczne zniżki. Najbardziej popularne produkty, które dostępne są w ograniczonej ilości mają niesamowite wzięcie i rozchodzą się dosłownie w kilka sekund.
Szczególnie dotyczy to elektroniki lub markowych ubrań tak uwielbianych przez Chińczyków. 10 listopada czekają aż zegar wybije północ, aby zdążyć kupić swój pożądany przedmiot.
Chińskie Allegro a zwroty
Ostatnią rzeczą, którą chciałbym opisać to zwroty. Taobao rozwiązało to w bardzo prosty sposób. Najpierw należy zgłosić chęć oddania przedmiotu sprzedającemu. Nie musimy niczego pisać, wystarczy wybrać opcję “Zwrot”, wybrać powód z listy i czekać na decyzję sprzedawcy.
Rzadko się zdarza, że sprzedawca robi  jakiekolwiek problemy. Gdy już sprzedawca wyrazi zgodę, to możemy zamówić kuriera bezpośrednio przez Taobao lub na własną rękę.
W pierwszym przypadku wybieramy datę i godzinę kiedy ma przyjść kurier. Nie musimy nawet pakować przedmiotu! Kurier zrobi to za nas. Za kuriera musimy zapłacić, a ceny różnią się w zależności od przedmiotu, jednakże za małe przedmiotu jest to zazwyczaj koszt kilku złotych.
Pieniądze są czasem zwracane nam nawet w ciągu kilku godzin.
Niewątpliwie Chińczycy opanowali sztukę e-commerce do perfekcji, dlatego liczby, które generują nie powinny nikogo dziwić. Duży wybór, prostota, bezpieczeństwo, to wszystko co gwarantuje nam chińskie Allegro – Taobao.
"
20,Jak się przedstawić po chińsku – podstawy,30/04/2020,Język chiński,"
Jednym z powodów, dla którego nauka języka chińskiego może być prostsza od innych języków jest jego banalna gramatyka, o czym wspomniałem tutaj.
Najprostszym sposobem, aby się o tym przekonać jest zobaczyć jak to działa w praktyce.
Cześć!
Warto byłoby zacząć od przywitania się! A więc jak powiedzieć cześć po chińsku?
你好！- Nǐhǎo! – Cześć!
Co oznacza każdy znak?
你 nǐ – ty
好 hǎo – dobry, być dobrym
Co to za dziwne kreski nad “i” i “a”? Te dziwne kreski to tony. Język chiński jest językiem tonalnym, w którym rozróżniamy cztery tony, więcej o tonach tutaj.
Mam na imię…
我叫David –  Wǒ jiào David (spolszczona transkrypcja wymowy: ło dźao David)- Mam na imię David.
我 – wǒ – ja
叫 – jiào – mieć na imię, nazywać się
Miejsce wǒ mógłby zająć inny zaimek osobowy np. Nǐ:
你叫David – Nǐ jiào David  – Masz na imię David.
Żadnego dodawania końcówek, żadnych odmian, proste!
Jestem Polakiem
我是波兰人 – Wǒ shì bōlán rén (ło szy bolan żen) – Jestem Polakiem/Polką. 
我 – wǒ – ja
是 – shì – być
波兰 – Bōlán – Polska
人 – rén – człowiek
波兰人 – Bōlánrén – Polak/Polka
Jak widzisz chińska składnia jest bardzo prosta i logiczna – podmiot, orzeczenie i dopełnienie. Tworzenie zdań, to nic innego jak dopasowywanie do siebie odpowiednich znaków, a o odmianę nie musimy się martwić.
Teraz już wiesz jak się przedstawić po chińsku. Jak widzisz, to nie takie trudne! To dopiero początek, ale doskonale obrazuje jak działa język chiński!
"
21,"Chińskie seriale, które musisz zobaczyć",28/04/2020,Kultura,"
Najlepsze chińskie seriale – subiektywny ranking
Chińskie seriale, to w większości rozrywka dla pasjonatów, którym nie przeszkadza fatalna gra aktorska i nudna fabuła. Jednakże wśród chińskich seriali da się znaleźć perełki, przed którymi ciężko przejść obojętnie.
All is Well 都挺好
All is Well
Serial opowiada historię fikcyjnej chińskiej rodziny rozdartej wewnętrznym konfliktem. 
Rodzina Su upada wraz z nagłą śmiercią matki Su. Odejście matki, która była głową rodziny i trzymała ojca pod pantoflem sprawiło, że nieporadnym i samolubnym ojcem muszą zaopiekować się dzieci. Nagły wypadek przerywa spokojne życie dwóch starszych braci i młodej siostry. Su Ming Yu to młodsza siostra, której chłodne relacje z owdowiałym ojcem i jednym z dwóch braci powodują wiele konfliktów.
Fabuła na pierwszy rzut oka szału nie robi, a więc co sprawia, że All is Well stało się absolutnym hitem w Chinach?
Fenomen tego chińskiego serialu polega na jego brutalnym ukazaniu rzeczywistości. 
All is well obnaża słabości wielu aspektów chińskiej kultury, których ślepe respektowanie prowadzi do konfliktów, a nawet przemocy.
Motyw twarzy w kulturze chińskiej przewija się przez wszystkie odcinki, który w wielu przypadkach jest głównym powodem zwar rodzinnych. 面子, czyli twarz w kulturze Chin może być opisana jako to jak postrzegają nas inni. Twarz można utożsamić z prestiżem, statusem społecznym, a nawet honorem.
Poza tym, serial świetnie obrazuje współczesne życie Chińczyków z perspektywy pracy, szkoły, rodziny, a także związków. All is Well to tytuł, od którego powinniśmy zacząć naszą przygodę z chińskimi serialami. 
All is Well dostępne jest na YouTubie z angielskimi napisami tutaj.
Day and Night
Day and Night 白夜追凶
Kolejny chiński serial, który chce polecić na dziś to Day and Night.
Guan Hong Yu zostaje oskarżony o zamordowanie całej rodziny. Aby wyjaśnić zarzuty młodszego brata bliźniaka, lider zespołu śledczego Guan Hong Feng chce zająć się tą sprawą. Jednakże, ponieważ jest krewnym, nie może brać udziału w dochodzeniu.
Pojawia się nowy lider zespołu o imieniu Zhou Shu Tong. Zhou Shu Tong i Hong Feng jako jego „konsultant” wspólnie rozpracowują wiele spraw. Hong Feng skrywa jednak tajemnicę: strach przed ciemnością. W związku z czym, „Hong Feng”, który pojawia się na posterunku policji w ciągu dnia i nocy nie jest właściwie tą samą osobą. Wspólnie bliźniacy potajemnie próbują odkryć prawdę o morderstwie, o które jest posądzony jeden z braci,
Chińskie seriale rzadko kiedy potrafią opowiedzieć historię bez przesadnego przekoloryzowania rzeczywistości. Day and Night jest pewnego rodzaju wyjątkiem.
Mamy tutaj do czynienia z bardzo dobrym kryminałem, którego wciągająca fabuła, a także dobra gra aktorska jest uzupełniona przepięknymi ujęciami. 
Day and Night to obowiązkowa pozycja wśród chińskich seriali dla fanów dobrego kina. Możesz zobaczyć teledysk, to piosenki przewodniej i klipy z serialu tutaj.
Zobacz więcej wpisów na temat kultury Chin tutaj.
Źródło: własne, mydramalist.com
"
